{
  "$schema": "https://json-schema.org/draft/2020-12/schema",
  "title": "KYA-OS community registry entry",
  "description": "One entry in the KYA-OS community registry. Each entry lives at registry/builders/<slug>.json and the filename must equal the `slug` property. Structural validation is enforced by scripts/validate.mjs (including cross-file checks this schema cannot express, like `standards` slugs resolving to registry/interop/ files); keep that script and this schema in sync.",
  "type": "object",
  "additionalProperties": false,
  "required": [
    "name",
    "slug",
    "description",
    "homepage",
    "kind",
    "listedAt"
  ],
  "properties": {
    "name": {
      "type": "string",
      "minLength": 1,
      "maxLength": 80,
      "description": "Display name of the project or team."
    },
    "slug": {
      "type": "string",
      "pattern": "^[a-z0-9-]{2,40}$",
      "description": "URL-safe identifier. Must match the entry filename: registry/builders/<slug>.json. Unique across the whole registry (builders AND interop)."
    },
    "description": {
      "type": "string",
      "minLength": 1,
      "maxLength": 280,
      "description": "Short description of what this entry ships on KYA-OS (280 characters max)."
    },
    "homepage": {
      "type": "string",
      "format": "uri",
      "pattern": "^https://",
      "description": "Project homepage. https only."
    },
    "repo": {
      "type": "string",
      "format": "uri",
      "pattern": "^https://",
      "description": "Source repository. https only."
    },
    "kind": {
      "enum": [
        "implementation",
        "service",
        "template",
        "example",
        "integration",
        "marketplace"
      ],
      "description": "What kind of entry this is. Determines which site section renders it: implementation/service/integration/marketplace go to #builders, template to #templates, example to #examples."
    },
    "buildsOn": {
      "type": "array",
      "minItems": 1,
      "uniqueItems": true,
      "items": {
        "enum": [
          "kya-os-mcp",
          "kya-os-schema",
          "kya-os",
          "spec"
        ]
      },
      "description": "Which KYA-OS repos this entry builds on."
    },
    "standards": {
      "type": "array",
      "minItems": 1,
      "uniqueItems": true,
      "items": {
        "type": "string",
        "pattern": "^[a-z0-9-]{2,40}$"
      },
      "description": "Interop-registry slugs this entry exercises. Every slug MUST exist as registry/interop/<slug>.json (cross-file check enforced by scripts/validate.mjs)."
    },
    "conformance": {
      "type": "object",
      "additionalProperties": false,
      "required": [
        "level",
        "scope",
        "suiteVersion",
        "status"
      ],
      "properties": {
        "level": {
          "enum": [
            "L1",
            "L2",
            "L3"
          ],
          "description": "Compliance level claimed, per kya-os-mcp CONFORMANCE.md."
        },
        "scope": {
          "enum": [
            "full",
            "subset"
          ],
          "description": "Whether the claim covers every vector category at the level, or a named subset. A subset never renders as a bare level."
        },
        "categories": {
          "type": "array",
          "minItems": 1,
          "uniqueItems": true,
          "items": {
            "type": "string",
            "pattern": "^[a-z0-9-]{2,40}$"
          },
          "description": "Vector categories the claim covers (e.g. signed-proof). Required when scope is subset."
        },
        "suiteVersion": {
          "type": "string",
          "pattern": "^\\d+\\.\\d+\\.\\d+$",
          "description": "The conformance suite version the claim ran against (semver)."
        },
        "status": {
          "enum": [
            "self-reported",
            "in-verification",
            "verified",
            "revoked"
          ],
          "description": "Claim status. `verified` requires `attestationUrl` and renders green only after the site build cryptographically verifies that credential; `revoked` is the terminal post-verified state set by the program's revocation workflow and keeps `attestationUrl` as the public record; anything else renders amber or grey."
        },
        "attestationUrl": {
          "type": "string",
          "format": "uri",
          "pattern": "^https://",
          "description": "Canonical URL of the verification credential (https://builders.kya-os.org/credentials/<id32>.json). Required when status is verified or revoked; forbidden below the verified rung."
        },
        "evidenceUrl": {
          "type": "string",
          "format": "uri",
          "pattern": "^https://",
          "description": "Public URL grounding the claim at its current status - the conformance submission issue or verification thread. The site renders non-verified status chips as links to it. Distinct from attestationUrl, which is the credential itself."
        },
        "supersedes": {
          "type": "string",
          "format": "uri",
          "pattern": "^https://",
          "description": "Re-attestation only: the attestationUrl of the credential this entry held before the claim moved back to in-verification. The next issuance revokes it as superseded in the same signed run. Allowed only at status in-verification, and only for a committed, unrevoked credential issued to this entry."
        }
      },
      "if": {
        "properties": {
          "scope": {
            "const": "subset"
          }
        },
        "required": [
          "scope"
        ]
      },
      "then": {
        "required": [
          "categories"
        ]
      },
      "allOf": [
        {
          "if": {
            "properties": {
              "status": {
                "enum": [
                  "verified",
                  "revoked"
                ]
              }
            },
            "required": [
              "status"
            ]
          },
          "then": {
            "required": [
              "attestationUrl"
            ]
          },
          "else": {
            "not": {
              "required": [
                "attestationUrl"
              ]
            }
          }
        }
      ],
      "description": "Conformance claim for this entry. Honesty rules: subset claims always name their categories; verified requires the credential link."
    },
    "probeUrl": {
      "type": "string",
      "format": "uri",
      "pattern": "^https://",
      "description": "The live MCP endpoint the daily enforcement probe hits (service and implementation kinds only - enforced by scripts/validate.mjs). The probe sends one bare JSON-RPC request and records whether the deployment refuses it (enforcing), answers it (open), or cannot be classified (unreachable); results are committed to registry/probes.json and rendered dated on the directory."
    },
    "deploy": {
      "type": "array",
      "minItems": 1,
      "items": {
        "type": "object",
        "additionalProperties": false,
        "required": [
          "platform",
          "url"
        ],
        "properties": {
          "platform": {
            "enum": [
              "vercel",
              "railway",
              "cloudflare",
              "docker",
              "other"
            ],
            "description": "Deploy target the URL launches on."
          },
          "url": {
            "type": "string",
            "format": "uri",
            "pattern": "^https://",
            "description": "One-click deploy URL. https only."
          }
        }
      },
      "description": "One-click deploy targets, rendered as deploy buttons on template entries."
    },
    "contact": {
      "type": "object",
      "additionalProperties": false,
      "minProperties": 1,
      "properties": {
        "email": {
          "type": "string",
          "format": "email",
          "description": "Contact email address."
        },
        "github": {
          "type": "string",
          "pattern": "^[a-zA-Z0-9-]{1,39}$",
          "description": "GitHub username (no @ prefix)."
        },
        "press-email": {
          "type": "string",
          "format": "email",
          "description": "Press or media contact email address."
        }
      },
      "description": "How maintainers can reach you about this entry; press-email is for media inquiries."
    },
    "listedAt": {
      "type": "string",
      "format": "date",
      "description": "Date the entry was added, YYYY-MM-DD."
    }
  }
}
