{
  "name": "@kya-os/mcp",
  "slug": "kya-os-mcp",
  "description": "The reference implementation of KYA-OS for MCP servers: DID identity, scoped delegation with consent gating, and detached-JWS proofs in two added lines. The conformance vectors derive from this codebase, so its full-suite pass is self-reported, not independent evidence.",
  "homepage": "https://kya-os.org",
  "repo": "https://github.com/decentralized-identity/kya-os-mcp",
  "kind": "implementation",
  "conformance": {
    "level": "L3",
    "scope": "full",
    "suiteVersion": "1.2.0",
    "status": "in-verification",
    "supersedes": "https://builders.kya-os.org/credentials/9e47cb59a81b738ea0681848c704b547.json",
    "evidenceUrl": "https://github.com/kya-os/kya-os-usergroup/issues/45"
  },
  "listedAt": "2026-08-20"
}
