{
  "name": "KYA-OS Walkthrough",
  "slug": "kya-os-walkthrough",
  "description": "A guided walkthrough that checks the hosted demo server live, every verdict from the reference verifier. /compare sets standard MCP beside the KYA-OS extension; /attack starts from a stolen token, a compromised sub-agent or an edited audit log and shows which layer refuses each.",
  "homepage": "https://poc.kya-os.ai",
  "kind": "example",
  "buildsOn": [
    "kya-os-mcp"
  ],
  "listedAt": "2026-10-08"
}
