{
  "name": "KYA-OS Demo Server",
  "slug": "kya-os-demo-server",
  "description": "A live hosted MCP server speaking KYA-OS: handshake, signed proofs, and delegation against a real endpoint, for anyone who wants to poke the protocol before running their own. Speak MCP to POST /mcp (GET /health for liveness); the root URL serves no landing page yet.",
  "homepage": "https://demo-mcp.kya-os.ai/health",
  "kind": "service",
  "buildsOn": [
    "kya-os-mcp"
  ],
  "probeUrl": "https://demo-mcp.kya-os.ai/mcp",
  "listedAt": "2026-08-19",
  "conformance": {
    "level": "L3",
    "scope": "full",
    "suiteVersion": "1.1.0",
    "status": "verified",
    "attestationUrl": "https://builders.kya-os.org/credentials/8d72565e362330ebccb3709324aee2aa.json",
    "evidenceUrl": "https://github.com/kya-os/kya-os-usergroup/issues/37"
  }
}
